{
  "$schema": "https://json-schema.org/draft/2020-12/schema",
  "$id": "https://example.invalid/contracts/v1/trade-breakdown-report.schema.json",
  "title": "TradeBreakdownReportV1",
  "type": "object",
  "additionalProperties": false,
  "required": ["schema_version", "generated_at", "currency", "definitions", "reversal_from_profit", "breakdowns"],
  "properties": {
    "schema_version": {"const": "1.0"},
    "generated_at": {"type": "string", "format": "date-time"},
    "currency": {"const": "ACCOUNT_CURRENCY"},
    "definitions": {"type": "object"},
    "reversal_from_profit": {"type": "object"},
    "giveback_from_peak_profit": {"type": "object"},
    "time_stop": {"type": "object"},
    "range_exit": {"type": "object"},
    "trend_reversal_exit": {"type": "object"},
    "early_adverse_exit": {"type": "object"},
    "breakdowns": {"type": "object"},
    "entry_pipeline_funnel": {"type": "object"}
  }
}
