{
  "schema_version": "1.0",
  "generated_at": "2026-09-17T13:11:13.166013Z",
  "currency": "ACCOUNT_CURRENCY",
  "definitions": {
    "session": "UTCの概算時間帯によるSession区分、Entry時刻基準（DST未考慮の簡略化）",
    "atr_band": "エントリー時H1 ATRの実データ分位点による帯（区間はデータ依存で固定値ではない）",
    "adx_band": "エントリー時H1 ADXの実データ分位点による帯",
    "hold_time_band": "保有時間（時間単位）の実データ分位点による帯",
    "mfe_band": "MFE（最大含み益、口座通貨、手数料除く）の実データ分位点による帯",
    "mae_band": "MAE（最大含み損、口座通貨、手数料除く）の実データ分位点による帯",
    "r_multiple": "net_pnl / risk_budget（RISK_DECISIONで承認されたリスク額）",
    "market_regime_trend": "EA側CMarketRegimeClassifierによるEntry時点のトレンド判定（TrendUp/TrendDown/Range、判定不能時はUnknown）",
    "market_regime_volatility": "EA側CMarketRegimeClassifierによるEntry時点のボラティリティ判定（HighVolatility/NormalVolatility/LowVolatility、判定不能時はUnknown）",
    "close_reason": "決済トリガー（SL/TP/SO/EXPERT/CLIENT等、MT5 DEAL_REASONをそのまま文字列化。EXPERTはEA発注によるEmergency Close等）",
    "close_session": "UTCの概算時間帯によるSession区分、Exit（決済）時刻基準",
    "close_weekday": "決済時刻の曜日（UTC基準）",
    "giveback_ratio": "(mfe - net_pnl) / mfe。MFE到達後、決済までに手放した利益の割合。1.0以上は損益ゼロ以下まで完全反転したことを示す。MFE<=0のトレードはNaN",
    "giveback_band": "giveback_ratioの実データ分位点による帯",
    "time_stop_reason_code": "Time Stop（時間切れ決済）で決済された場合の理由コード（MAX_HOLDING_BARS/MAX_HOLDING_BARS_MIN_MFE_NOT_REACHED）。Time Stop以外の決済ではNaN",
    "time_stop_triggered": "time_stop_reason_codeがNaNでないトレードはTrue。InpEnableTimeStop=falseのバックテストでは常にFalse",
    "range_exit_reason_code": "レンジ相場逆張り戦略の強制決済で決済された場合の理由コード（RANGE_BREAK/BB_WIDTH_EXPANSION/MEAN_REVERSION_MAX_HOLDING_BARS）。該当しない決済ではNaN",
    "range_exit_triggered": "range_exit_reason_codeがNaNでないトレードはTrue。InpEnableMeanReversionStrategy=falseのバックテストでは常にFalse",
    "trend_reversal_reason_code": "トレンド継続反転Exitで決済された場合の理由コード（TrendReversalConfirmed固定）。該当しない決済ではNaN",
    "trend_reversal_triggered": "trend_reversal_reason_codeがNaNでないトレードはTrue。InpEnableTrendReversalExit=falseのバックテストでは常にFalse",
    "trend_reversal_trend_direction": "反転Exit発動時点の市場レジームトレンド方向（TrendUp/TrendDown）。該当しない決済ではNaN",
    "trend_reversal_peak_mfe_r_multiple": "反転Exit発動時点までの含み益ピーク（建値〜当初SL距離を1RとするR倍数）。該当しない決済ではNaN",
    "trend_reversal_retracement_r_multiple": "反転Exit発動時点でのPeakからの逆行幅（R倍数）。該当しない決済ではNaN",
    "reached_tp_equivalent_r": "mfe_rがそのトレード自身のTP相当R（candidate_risk_reward_ratio）以上に達したか。SL到達トレードでは「あと一歩でTPだった」の近似指標、反転Exit/初期逆行Exitトレードでは「早期Exitしなければ後にTPへ到達していた可能性」の近似指標",
    "early_adverse_exit_reason_code": "初期逆行Exitで決済された場合の理由コード（EarlyAdverseConfirmed固定）。該当しない決済ではNaN",
    "early_adverse_exit_triggered": "early_adverse_exit_reason_codeがNaNでないトレードはTrue。InpEnableEarlyAdverseExit=falseのバックテストでは常にFalse",
    "early_adverse_exit_adverse_r_multiple": "初期逆行Exit発動時点での建値からの逆行幅（建値〜当初SL距離を1RとするR倍数）。該当しない決済ではNaN"
  },
  "reversal_from_profit": {
    "losing_trades_total": 16,
    "losing_trades_with_mfe_data": 16,
    "losing_trades_that_reached_unrealized_profit": 15,
    "share_of_losing_trades_with_data": 0.9375,
    "average_mfe_before_reversal": 2152.9333333333334
  },
  "giveback_from_peak_profit": {
    "trades_with_unrealized_profit": 27,
    "average_giveback_ratio": 5.39957241865478,
    "median_giveback_ratio": 1.1393333333333333,
    "trades_that_fully_reversed_to_breakeven_or_loss": 17,
    "share_that_fully_reversed": 0.6296296296296297
  },
  "time_stop": {
    "trades_closed_by_time_stop": 0,
    "net_profit": 0.0,
    "win_rate": 0.0,
    "profit_factor": null,
    "expectancy": 0.0,
    "average_win": null,
    "average_loss": null
  },
  "range_exit": {
    "trades_closed_by_range_exit": 0,
    "net_profit": 0.0,
    "win_rate": 0.0,
    "profit_factor": null,
    "expectancy": 0.0,
    "average_win": null,
    "average_loss": null,
    "by_reason_code": {}
  },
  "trend_reversal_exit": {
    "trades_closed_by_trend_reversal_exit": 0,
    "net_profit": 0.0,
    "win_rate": 0.0,
    "profit_factor": null,
    "expectancy": 0.0,
    "average_win": null,
    "average_loss": null,
    "average_peak_mfe_r_multiple": null,
    "average_retracement_r_multiple": null,
    "trades_that_would_likely_have_reached_tp": 0,
    "net_pnl_of_trades_that_would_likely_have_reached_tp": null,
    "by_trend_direction": {}
  },
  "early_adverse_exit": {
    "trades_closed_by_early_adverse_exit": 14,
    "net_profit": -51986.0,
    "win_rate": 0.0,
    "profit_factor": 0.0,
    "expectancy": -3713.285714285714,
    "average_win": null,
    "average_loss": -3713.285714285714,
    "average_adverse_r_multiple": 0.7625554643357144,
    "trades_that_would_likely_have_reached_tp": 0,
    "net_pnl_of_trades_that_would_likely_have_reached_tp": null,
    "by_direction": {
      "BUY": {
        "number_of_trades": 13,
        "net_profit": -48386.0,
        "win_rate": 0.0,
        "profit_factor": 0.0,
        "expectancy": -3722.0,
        "average_win": null,
        "average_loss": -3722.0
      },
      "SELL": {
        "number_of_trades": 1,
        "net_profit": -3600.0,
        "win_rate": 0.0,
        "profit_factor": 0.0,
        "expectancy": -3600.0,
        "average_win": null,
        "average_loss": -3600.0
      }
    }
  },
  "breakdowns": {
    "direction": [
      {
        "direction": "BUY",
        "number_of_trades": 26,
        "net_profit": 19489.0,
        "win_rate": 0.38461538461538464,
        "profit_factor": 1.402573795211832,
        "expectancy": 749.5769230769231,
        "average_win": 6790.0,
        "average_loss": -3457.9285714285716
      },
      {
        "direction": "SELL",
        "number_of_trades": 2,
        "net_profit": -4227.0,
        "win_rate": 0.0,
        "profit_factor": 0.0,
        "expectancy": -2113.5,
        "average_win": null,
        "average_loss": -2113.5
      }
    ],
    "session": [
      {
        "session": "London",
        "number_of_trades": 10,
        "net_profit": -2974.0,
        "win_rate": 0.2,
        "profit_factor": 0.868074346803886,
        "expectancy": -297.4,
        "average_win": 9784.5,
        "average_loss": -3220.4285714285716
      },
      {
        "session": "London_NewYork_Overlap",
        "number_of_trades": 5,
        "net_profit": 23577.0,
        "win_rate": 0.6,
        "profit_factor": 7.133454734651405,
        "expectancy": 4715.4,
        "average_win": 9140.333333333334,
        "average_loss": -3844.0
      },
      {
        "session": "NewYork",
        "number_of_trades": 5,
        "net_profit": -2314.0,
        "win_rate": 0.6,
        "profit_factor": 0.43214723926380366,
        "expectancy": -462.8,
        "average_win": 587.0,
        "average_loss": -2037.5
      },
      {
        "session": "Tokyo",
        "number_of_trades": 8,
        "net_profit": -3027.0,
        "win_rate": 0.25,
        "profit_factor": 0.8635010822510822,
        "expectancy": -378.375,
        "average_win": 9574.5,
        "average_loss": -3696.0
      }
    ],
    "weekday": [
      {
        "weekday": "Fri",
        "number_of_trades": 5,
        "net_profit": -7481.0,
        "win_rate": 0.0,
        "profit_factor": 0.0,
        "expectancy": -1496.2,
        "average_win": null,
        "average_loss": -2493.6666666666665
      },
      {
        "weekday": "Mon",
        "number_of_trades": 6,
        "net_profit": -808.0,
        "win_rate": 0.5,
        "profit_factor": 0.9252682204957454,
        "expectancy": -134.66666666666666,
        "average_win": 3334.6666666666665,
        "average_loss": -3604.0
      },
      {
        "weekday": "Thu",
        "number_of_trades": 3,
        "net_profit": 14805.0,
        "win_rate": 0.6666666666666666,
        "profit_factor": 4.995951417004049,
        "expectancy": 4935.0,
        "average_win": 9255.0,
        "average_loss": -3705.0
      },
      {
        "weekday": "Tue",
        "number_of_trades": 6,
        "net_profit": 20604.0,
        "win_rate": 0.5,
        "profit_factor": 3.5446461652463874,
        "expectancy": 3434.0,
        "average_win": 9567.0,
        "average_loss": -2699.0
      },
      {
        "weekday": "Wed",
        "number_of_trades": 8,
        "net_profit": -11858.0,
        "win_rate": 0.25,
        "profit_factor": 0.47398305460675155,
        "expectancy": -1482.25,
        "average_win": 5342.5,
        "average_loss": -3757.1666666666665
      }
    ],
    "atr_band": [
      {
        "atr_band": "ATR_0.0705-0.0869",
        "number_of_trades": 9,
        "net_profit": 5074.0,
        "win_rate": 0.3333333333333333,
        "profit_factor": 1.2211278654231674,
        "expectancy": 563.7777777777778,
        "average_win": 9340.0,
        "average_loss": -3824.3333333333335
      },
      {
        "atr_band": "ATR_0.0869-0.111",
        "number_of_trades": 9,
        "net_profit": 12673.0,
        "win_rate": 0.3333333333333333,
        "profit_factor": 2.5985116044399597,
        "expectancy": 1408.111111111111,
        "average_win": 6867.0,
        "average_loss": -1982.0
      },
      {
        "atr_band": "ATR_0.111-0.158",
        "number_of_trades": 10,
        "net_profit": -2485.0,
        "win_rate": 0.4,
        "profit_factor": 0.8858206212093365,
        "expectancy": -248.5,
        "average_win": 4819.75,
        "average_loss": -3627.3333333333335
      }
    ],
    "adx_band": [
      {
        "adx_band": "ADX_40.55-42.02",
        "number_of_trades": 10,
        "net_profit": 21727.0,
        "win_rate": 0.5,
        "profit_factor": 2.1812003914319886,
        "expectancy": 2172.7,
        "average_win": 8024.2,
        "average_loss": -3678.8
      },
      {
        "adx_band": "ADX_42.02-44.6",
        "number_of_trades": 9,
        "net_profit": 6280.0,
        "win_rate": 0.4444444444444444,
        "profit_factor": 1.5256549761446387,
        "expectancy": 697.7777777777778,
        "average_win": 4556.75,
        "average_loss": -2986.75
      },
      {
        "adx_band": "ADX_44.6-53.97",
        "number_of_trades": 9,
        "net_profit": -12745.0,
        "win_rate": 0.1111111111111111,
        "profit_factor": 0.4283984392519173,